name;setting;category;short_desc;extra_desc;context;vartype;source;min_val;max_val
"vacuum_cost_page_dirty";"20";"Resource Usage";"Vacuum cost for a page dirtied by vacuum.";"";"user";"integer";"default";"0";"10000"
"vacuum_cost_page_hit";"1";"Resource Usage";"Vacuum cost for a page found in the buffer cache.";"";"user";"integer";"default";"0";"10000"
"vacuum_cost_page_miss";"10";"Resource Usage";"Vacuum cost for a page not found in the buffer cache.";"";"user";"integer";"default";"0";"10000"
"wal_buffers";"8";"Write-Ahead Log / Settings";"Sets the number of disk-page buffers in shared memory for WAL.";"";"postmaster";"integer";"default";"4";"262143"
"wal_sync_method";"fsync";"Write-Ahead Log / Settings";"Selects the method used for forcing WAL updates out to disk.";"";"sighup";"string";"default";"";""
"work_mem";"1024";"Resource Usage / Memory";"Sets the maximum memory to be used for query workspaces.";"This much memory may be used by each internal sort operation and hash table before switching to temporary disk files.";"user";"integer";"default";"64";"2097151"
"zero_damaged_pages";"off";"Developer Options";"Continues processing past damaged page headers.";"Detection of a damaged page header normally causes PostgreSQL to report an error, aborting the current transaction. Setting zero_damaged_pages to true causes the system to instead report a warning, zero out the damaged page, and continue processing. This behavior will destroy data, namely all the rows on the damaged page.";"superuser";"bool";"default";"";""
